{
  "entries": [
    {
      "context": "validation passed",
      "cycle": 1,
      "outcome": "passed",
      "raw_conclusion": "success",
      "raw_status": "pass",
      "recorded_at": "2026-06-11T06:43:50Z",
      "run_attempt": 1,
      "run_id": 27328834665,
      "run_url": "https://github.com/shubhodeep1/coding-workflows/actions/runs/27328834665",
      "source": "orchestrate_poll.mark_validation_complete"
    }
  ],
  "integration_sha": "0ee840d6dbd2d6f16889a1857e74d29144ac221b",
  "repository": "shubhodeep1/coding-workflows",
  "schema_version": "v1"
}
